{
  "schemaVersion": "0.70",
  "planningReference": "ASYNC_TEST",
  "timezone": "Asia/Singapore",
  "fixedRotationOffset": true,
  "planningHorizon": {
    "startDate": "2025-12-01",
    "endDate": "2025-12-05"
  },
  "publicHolidays": [],
  "solverRunTime": {
    "maxSeconds": 5
  },
  "schemeMap": {
    "A": "SchemeA"
  },
  "constraintList": [
    {
      "id": "oneShiftPerDay",
      "enforcement": "hard",
      "description": "Max 1 shift per employee per day",
      "params": {}
    }
  ],
  "solverScoreConfig": {},
  "demandItems": [
    {
      "demandId": "D_TEST",
      "locationId": "TestSite",
      "ouId": "OU-TEST",
      "shiftStartDate": "2025-12-01",
      "shifts": [
        {
          "shiftDetails": [
            {
              "shiftCode": "D",
              "start": "08:00",
              "end": "20:00",
              "nextDay": false
            }
          ],
          "includePublicHolidays": false,
          "includeEveOfPublicHolidays": false,
          "shiftSetId": "Set_Test",
          "coverageDays": ["Mon", "Tue", "Wed", "Thu", "Fri"],
          "coverageAnchor": "2025-12-01",
          "whitelist": {
            "teamIds": ["TEAM-TEST"],
            "employeeIds": []
          },
          "blacklist": {
            "employeeIds": []
          }
        }
      ],
      "requirements": [
        {
          "requirementId": "REQ1",
          "productTypeId": "TEST",
          "rankId": "TEST",
          "headcount": 1,
          "workPattern": ["D", "D", "O"],
          "requiredQualifications": [],
          "gender": "Any",
          "Scheme": "A"
        }
      ]
    }
  ],
  "employees": [
    {
      "employeeId": "EMP_001",
      "ouId": "OU-TEST",
      "teamId": "TEAM-TEST",
      "productTypeId": "TEST",
      "rankId": "TEST",
      "scheme": "A",
      "rotationOffset": 0,
      "gender": "M",
      "qualifications": [],
      "preferences": {},
      "unavailability": []
    },
    {
      "employeeId": "EMP_002",
      "ouId": "OU-TEST",
      "teamId": "TEAM-TEST",
      "productTypeId": "TEST",
      "rankId": "TEST",
      "scheme": "A",
      "rotationOffset": 1,
      "gender": "M",
      "qualifications": [],
      "preferences": {},
      "unavailability": []
    }
  ]
}
